      "[I 2025-06-07 08:52:17,143] Trial 0 finished with value: 0.15633802115917206 and parameters: {'optimizer': 'adam', 'loss_function': 'kld', 'dense_units': 512, 'learning_rate': 7.074675577760267e-05, 'num_unfrozen_layers': 9}. Best is trial 0 with value: 0.15633802115917206.\n"
     ]
    },
    {
     "name": "stdout",
     "output_type": "stream",
     "text": [
      "Found 4276 images belonging to 7 classes.\n",
      "Found 1420 images belonging to 7 classes.\n"
     ]
    },
    {
     "name": "stderr",
     "output_type": "stream",
     "text": [
      "2025-06-07 08:52:37.554184: I external/local_xla/xla/service/gpu/autotuning/conv_algorithm_picker.cc:549] Omitted potentially buggy algorithm eng14{k25=0} for conv %cudnn-conv-bias-activation.46 = (f32[20,512,18,18]{3,2,1,0}, u8[0]{0}) custom-call(f32[20,256,18,18]{3,2,1,0} %bitcast.4507, f32[512,256,3,3]{3,2,1,0} %bitcast.4514, f32[512]{0} %bitcast.4516), window={size=3x3 pad=1_1x1_1}, dim_labels=bf01_oi01->bf01, custom_call_target=\"__cudnn$convBiasActivationForward\", metadata={op_type=\"Conv2D\" op_name=\"functional_1_1/vgg16_1/block4_conv1_1/convolution\" source_file=\"/home/eliana/escola/venv/lib/python3.12/site-packages/tensorflow/python/framework/ops.py\" source_line=1200}, backend_config={\"operation_queue_id\":\"0\",\"wait_on_operation_queues\":[],\"cudnn_conv_backend_config\":{\"conv_result_scale\":1,\"activation_mode\":\"kRelu\",\"side_input_scale\":0,\"leakyrelu_alpha\":0},\"force_earliest_schedule\":false}\n",
      "[I 2025-06-07 08:54:22,538] Trial 1 finished with value: 0.1619718372821808 and parameters: {'optimizer': 'sgd', 'loss_function': 'categorical_crossentropy', 'dense_units': 512, 'learning_rate': 5.4822599087775805e-05, 'num_unfrozen_layers': 7}. Best is trial 1 with value: 0.1619718372821808.\n"
     ]
    },
    {
     "name": "stdout",
     "output_type": "stream",
     "text": [
      "Found 4276 images belonging to 7 classes.\n",
      "Found 1420 images belonging to 7 classes.\n"
     ]
    },
    {
     "name": "stderr",
     "output_type": "stream",
     "text": [
      "2025-06-07 08:54:39.531330: I external/local_xla/xla/service/gpu/autotuning/conv_algorithm_picker.cc:549] Omitted potentially buggy algorithm eng14{k25=0} for conv %cudnn-conv-bias-activation.47 = (f32[20,512,18,18]{3,2,1,0}, u8[0]{0}) custom-call(f32[20,512,18,18]{3,2,1,0} %bitcast.4592, f32[512,512,3,3]{3,2,1,0} %bitcast.4599, f32[512]{0} %bitcast.4601), window={size=3x3 pad=1_1x1_1}, dim_labels=bf01_oi01->bf01, custom_call_target=\"__cudnn$convBiasActivationForward\", metadata={op_type=\"Conv2D\" op_name=\"functional_2_1/vgg16_1/block4_conv2_1/convolution\" source_file=\"/home/eliana/escola/venv/lib/python3.12/site-packages/tensorflow/python/framework/ops.py\" source_line=1200}, backend_config={\"operation_queue_id\":\"0\",\"wait_on_operation_queues\":[],\"cudnn_conv_backend_config\":{\"conv_result_scale\":1,\"activation_mode\":\"kRelu\",\"side_input_scale\":0,\"leakyrelu_alpha\":0},\"force_earliest_schedule\":false}\n",
      "2025-06-07 08:54:39.948172: I external/local_xla/xla/service/gpu/autotuning/conv_algorithm_picker.cc:549] Omitted potentially buggy algorithm eng14{k25=0} for conv %cudnn-conv-bias-activation.49 = (f32[20,512,9,9]{3,2,1,0}, u8[0]{0}) custom-call(f32[20,512,9,9]{3,2,1,0} %bitcast.4621, f32[512,512,3,3]{3,2,1,0} %bitcast.4628, f32[512]{0} %bitcast.4630), window={size=3x3 pad=1_1x1_1}, dim_labels=bf01_oi01->bf01, custom_call_target=\"__cudnn$convBiasActivationForward\", metadata={op_type=\"Conv2D\" op_name=\"functional_2_1/vgg16_1/block5_conv1_1/convolution\" source_file=\"/home/eliana/escola/venv/lib/python3.12/site-packages/tensorflow/python/framework/ops.py\" source_line=1200}, backend_config={\"operation_queue_id\":\"0\",\"wait_on_operation_queues\":[],\"cudnn_conv_backend_config\":{\"conv_result_scale\":1,\"activation_mode\":\"kRelu\",\"side_input_scale\":0,\"leakyrelu_alpha\":0},\"force_earliest_schedule\":false}\n",
      "[I 2025-06-07 08:56:17,282] Trial 2 finished with value: 0.15633802115917206 and parameters: {'optimizer': 'adam', 'loss_function': 'categorical_crossentropy', 'dense_units': 256, 'learning_rate': 1.991219777228297e-06, 'num_unfrozen_layers': 3}. Best is trial 1 with value: 0.1619718372821808.\n"
     ]
    },
    {
     "name": "stdout",
     "output_type": "stream",
     "text": [
      "Found 4276 images belonging to 7 classes.\n",
      "Found 1420 images belonging to 7 classes.\n"
     ]
    },
    {
     "name": "stderr",
     "output_type": "stream",
     "text": [
      "[I 2025-06-07 08:58:50,682] Trial 3 finished with value: 0.15633802115917206 and parameters: {'optimizer': 'adam', 'loss_function': 'kld', 'dense_units': 256, 'learning_rate': 7.42073414685837e-05, 'num_unfrozen_layers': 8}. Best is trial 1 with value: 0.1619718372821808.\n"
     ]
    },
    {
     "name": "stdout",
     "output_type": "stream",
     "text": [
      "Found 4276 images belonging to 7 classes.\n",
      "Found 1420 images belonging to 7 classes.\n"
     ]
    },
    {
     "name": "stderr",
     "output_type": "stream",
     "text": [
      "[I 2025-06-07 09:00:39,063] Trial 4 finished with value: 0.15633802115917206 and parameters: {'optimizer': 'sgd', 'loss_function': 'categorical_crossentropy', 'dense_units': 512, 'learning_rate': 5.235850456023968e-05, 'num_unfrozen_layers': 3}. Best is trial 1 with value: 0.1619718372821808.\n"
     ]
    },
    {
     "name": "stdout",
     "output_type": "stream",
     "text": [
      "Found 4276 images belonging to 7 classes.\n",
      "Found 1420 images belonging to 7 classes.\n"
     ]
    },
    {
     "name": "stderr",
     "output_type": "stream",
     "text": [
      "[I 2025-06-07 09:03:01,347] Trial 5 finished with value: 0.15633802115917206 and parameters: {'optimizer': 'rmsprop', 'loss_function': 'kld', 'dense_units': 128, 'learning_rate': 7.1530952084074836e-06, 'num_unfrozen_layers': 8}. Best is trial 1 with value: 0.1619718372821808.\n"
     ]
    },
    {
     "name": "stdout",
     "output_type": "stream",
     "text": [
      "Found 4276 images belonging to 7 classes.\n",
      "Found 1420 images belonging to 7 classes.\n"
     ]
    },
    {
     "name": "stderr",
     "output_type": "stream",
     "text": [
      "[I 2025-06-07 09:05:23,302] Trial 6 finished with value: 0.1570422500371933 and parameters: {'optimizer': 'rmsprop', 'loss_function': 'categorical_crossentropy', 'dense_units': 512, 'learning_rate': 2.6322738306993823e-06, 'num_unfrozen_layers': 8}. Best is trial 1 with value: 0.1619718372821808.\n"
     ]
    },
    {
     "name": "stdout",
     "output_type": "stream",
     "text": [
      "Found 4276 images belonging to 7 classes.\n",
      "Found 1420 images belonging to 7 classes.\n"
     ]
    },
    {
     "name": "stderr",
     "output_type": "stream",
     "text": [
      "[I 2025-06-07 09:07:37,680] Trial 7 finished with value: 0.15281690657138824 and parameters: {'optimizer': 'adam', 'loss_function': 'kld', 'dense_units': 128, 'learning_rate': 1.5754835195144468e-06, 'num_unfrozen_layers': 6}. Best is trial 1 with value: 0.1619718372821808.\n"
     ]
    },
    {
     "name": "stdout",
     "output_type": "stream",
     "text": [
      "Found 4276 images belonging to 7 classes.\n",
      "Found 1420 images belonging to 7 classes.\n"
     ]
    },
    {
     "name": "stderr",
     "output_type": "stream",
     "text": [
      "[I 2025-06-07 09:09:53,473] Trial 8 finished with value: 0.15422534942626953 and parameters: {'optimizer': 'rmsprop', 'loss_function': 'categorical_crossentropy', 'dense_units': 256, 'learning_rate': 1.9877700686441065e-05, 'num_unfrozen_layers': 7}. Best is trial 1 with value: 0.1619718372821808.\n"
     ]
    },
    {
     "name": "stdout",
     "output_type": "stream",
     "text": [
      "Found 4276 images belonging to 7 classes.\n",
      "Found 1420 images belonging to 7 classes.\n"
     ]
    },
    {
     "name": "stderr",
     "output_type": "stream",
     "text": [
      "[I 2025-06-07 09:11:58,728] Trial 9 finished with value: 0.15633802115917206 and parameters: {'optimizer': 'rmsprop', 'loss_function': 'kld', 'dense_units': 128, 'learning_rate': 6.1288999289894e-05, 'num_unfrozen_layers': 6}. Best is trial 1 with value: 0.1619718372821808.\n"
     ]
    },
    {
     "name": "stdout",
     "output_type": "stream",
     "text": [
      "Found 4276 images belonging to 7 classes.\n",
      "Found 1420 images belonging to 7 classes.\n"
     ]
    },
    {
     "name": "stderr",
     "output_type": "stream",
     "text": [
      "2025-06-07 09:12:00.377522: I external/local_xla/xla/service/gpu/autotuning/conv_algorithm_picker.cc:549] Omitted potentially buggy algorithm eng14{k25=0} for conv %cudnn-conv-bias-activation.45 = (f32[32,256,37,37]{3,2,1,0}, u8[0]{0}) custom-call(f32[32,256,37,37]{3,2,1,0} %bitcast.5141, f32[256,256,3,3]{3,2,1,0} %bitcast.4887, f32[256]{0} %bitcast.5509), window={size=3x3 pad=1_1x1_1}, dim_labels=bf01_oi01->bf01, custom_call_target=\"__cudnn$convBiasActivationForward\", metadata={op_type=\"Conv2D\" op_name=\"functional_10_1/vgg16_1/block3_conv3_1/convolution\" source_file=\"/home/eliana/escola/venv/lib/python3.12/site-packages/tensorflow/python/framework/ops.py\" source_line=1200}, backend_config={\"operation_queue_id\":\"0\",\"wait_on_operation_queues\":[],\"cudnn_conv_backend_config\":{\"conv_result_scale\":1,\"activation_mode\":\"kNone\",\"side_input_scale\":0,\"leakyrelu_alpha\":0},\"force_earliest_schedule\":false}\n",
      "2025-06-07 09:12:06.495200: I external/local_xla/xla/service/gpu/autotuning/conv_algorithm_picker.cc:549] Omitted potentially buggy algorithm eng14{k25=0} for conv %cudnn-conv-bias-activation.45 = (f32[20,256,37,37]{3,2,1,0}, u8[0]{0}) custom-call(f32[20,256,37,37]{3,2,1,0} %bitcast.5141, f32[256,256,3,3]{3,2,1,0} %bitcast.4887, f32[256]{0} %bitcast.5509), window={size=3x3 pad=1_1x1_1}, dim_labels=bf01_oi01->bf01, custom_call_target=\"__cudnn$convBiasActivationForward\", metadata={op_type=\"Conv2D\" op_name=\"functional_10_1/vgg16_1/block3_conv3_1/convolution\" source_file=\"/home/eliana/escola/venv/lib/python3.12/site-packages/tensorflow/python/framework/ops.py\" source_line=1200}, backend_config={\"operation_queue_id\":\"0\",\"wait_on_operation_queues\":[],\"cudnn_conv_backend_config\":{\"conv_result_scale\":1,\"activation_mode\":\"kNone\",\"side_input_scale\":0,\"leakyrelu_alpha\":0},\"force_earliest_schedule\":false}\n",
      "[I 2025-06-07 09:14:20,866] Trial 10 finished with value: 0.15985915064811707 and parameters: {'optimizer': 'sgd', 'loss_function': 'categorical_crossentropy', 'dense_units': 512, 'learning_rate': 1.9434572710928958e-05, 'num_unfrozen_layers': 10}. Best is trial 1 with value: 0.1619718372821808.\n"
     ]
    },
    {
     "name": "stdout",
     "output_type": "stream",
     "text": [
      "Found 4276 images belonging to 7 classes.\n",
      "Found 1420 images belonging to 7 classes.\n"
     ]
    },
    {
     "name": "stderr",
     "output_type": "stream",
     "text": [
      "[I 2025-06-07 09:16:40,297] Trial 11 finished with value: 0.1570422500371933 and parameters: {'optimizer': 'sgd', 'loss_function': 'categorical_crossentropy', 'dense_units': 512, 'learning_rate': 1.9599795990342558e-05, 'num_unfrozen_layers': 10}. Best is trial 1 with value: 0.1619718372821808.\n"
     ]
    },
    {
     "name": "stdout",
     "output_type": "stream",
     "text": [
      "Found 4276 images belonging to 7 classes.\n",
      "Found 1420 images belonging to 7 classes.\n"
     ]
    },
    {
     "name": "stderr",
     "output_type": "stream",
     "text": [
      "[I 2025-06-07 09:18:32,211] Trial 12 finished with value: 0.15422534942626953 and parameters: {'optimizer': 'sgd', 'loss_function': 'categorical_crossentropy', 'dense_units': 512, 'learning_rate': 1.857906441431534e-05, 'num_unfrozen_layers': 5}. Best is trial 1 with value: 0.1619718372821808.\n"
     ]
    },
    {
     "name": "stdout",
     "output_type": "stream",
     "text": [
      "Found 4276 images belonging to 7 classes.\n",
      "Found 1420 images belonging to 7 classes.\n"
     ]
    },
    {
     "name": "stderr",
     "output_type": "stream",
     "text": [
      "[I 2025-06-07 09:20:51,433] Trial 13 finished with value: 0.15422534942626953 and parameters: {'optimizer': 'sgd', 'loss_function': 'categorical_crossentropy', 'dense_units': 512, 'learning_rate': 7.040158757948416e-06, 'num_unfrozen_layers': 10}. Best is trial 1 with value: 0.1619718372821808.\n"
     ]
    },
    {
     "name": "stdout",
     "output_type": "stream",
     "text": [
      "Found 4276 images belonging to 7 classes.\n",
      "Found 1420 images belonging to 7 classes.\n"
     ]
    },
    {
     "name": "stderr",
     "output_type": "stream",
     "text": [
      "[I 2025-06-07 09:22:43,559] Trial 14 finished with value: 0.1654929518699646 and parameters: {'optimizer': 'sgd', 'loss_function': 'categorical_crossentropy', 'dense_units': 512, 'learning_rate': 3.449033551761605e-05, 'num_unfrozen_layers': 4}. Best is trial 14 with value: 0.1654929518699646.\n"
     ]
    },
    {
     "name": "stdout",
     "output_type": "stream",
     "text": [
      "Found 4276 images belonging to 7 classes.\n",
      "Found 1420 images belonging to 7 classes.\n"
     ]
    },
    {
     "name": "stderr",
     "output_type": "stream",
     "text": [
      "[I 2025-06-07 09:24:35,792] Trial 15 finished with value: 0.16478873789310455 and parameters: {'optimizer': 'sgd', 'loss_function': 'categorical_crossentropy', 'dense_units': 512, 'learning_rate': 3.830480226440939e-05, 'num_unfrozen_layers': 4}. Best is trial 14 with value: 0.1654929518699646.\n"
     ]
    },
    {
     "name": "stdout",
     "output_type": "stream",
     "text": [
      "Found 4276 images belonging to 7 classes.\n",
      "Found 1420 images belonging to 7 classes.\n"
     ]
    },
    {
     "name": "stderr",
     "output_type": "stream",
     "text": [
      "[I 2025-06-07 09:26:27,586] Trial 16 finished with value: 0.155633807182312 and parameters: {'optimizer': 'sgd', 'loss_function': 'categorical_crossentropy', 'dense_units': 512, 'learning_rate': 3.2304659972182286e-05, 'num_unfrozen_layers': 4}. Best is trial 14 with value: 0.1654929518699646.\n"
     ]
    },
    {
     "name": "stdout",
     "output_type": "stream",
     "text": [
      "Found 4276 images belonging to 7 classes.\n",
      "Found 1420 images belonging to 7 classes.\n"
     ]
    },
    {
     "name": "stderr",
     "output_type": "stream",
     "text": [
      "[I 2025-06-07 09:28:12,055] Trial 17 finished with value: 0.15633802115917206 and parameters: {'optimizer': 'sgd', 'loss_function': 'categorical_crossentropy', 'dense_units': 512, 'learning_rate': 3.207326209673205e-05, 'num_unfrozen_layers': 2}. Best is trial 14 with value: 0.1654929518699646.\n"
     ]
    },
    {
     "name": "stdout",
     "output_type": "stream",
     "text": [
      "Found 4276 images belonging to 7 classes.\n",
      "Found 1420 images belonging to 7 classes.\n"
     ]
    },
    {
     "name": "stderr",
     "output_type": "stream",
     "text": [
      "[I 2025-06-07 09:30:03,960] Trial 18 finished with value: 0.15422534942626953 and parameters: {'optimizer': 'sgd', 'loss_function': 'categorical_crossentropy', 'dense_units': 256, 'learning_rate': 1.0127653033300447e-05, 'num_unfrozen_layers': 4}. Best is trial 14 with value: 0.1654929518699646.\n"
     ]
    },
    {
     "name": "stdout",
     "output_type": "stream",
     "text": [
      "Found 4276 images belonging to 7 classes.\n",
      "Found 1420 images belonging to 7 classes.\n"
     ]
    },
    {
     "name": "stderr",
     "output_type": "stream",
     "text": [
      "[I 2025-06-07 09:31:55,598] Trial 19 finished with value: 0.155633807182312 and parameters: {'optimizer': 'sgd', 'loss_function': 'categorical_crossentropy', 'dense_units': 128, 'learning_rate': 9.66262338489009e-05, 'num_unfrozen_layers': 5}. Best is trial 14 with value: 0.1654929518699646.\n"
     ]
    },
    {
     "name": "stdout",
     "output_type": "stream",
     "text": [
      "Melhores parâmetros (Fine-Tuning): {'optimizer': 'sgd', 'loss_function': 'categorical_crossentropy', 'dense_units': 512, 'learning_rate': 3.449033551761605e-05, 'num_unfrozen_layers': 4}\n"
     ]
    }
   ],
   "source": [
    "import optuna\n",
    "import tensorflow as tf\n",
    "from tensorflow.keras import layers, models, optimizers\n",
    "from tensorflow.keras.applications import VGG16\n",
    "from tensorflow.keras.preprocessing.image import ImageDataGenerator\n",
    "\n",
    "\n",
    "def objective_ft(trial):\n",
    "    # Hiperparâmetros\n",
    "    optimizer_name = trial.suggest_categorical(\"optimizer\", [\"adam\", \"rmsprop\", \"sgd\"])\n",
    "    loss_fn = trial.suggest_categorical(\"loss_function\", [\"categorical_crossentropy\", \"kld\"])\n",
    "    dense_units = trial.suggest_categorical(\"dense_units\", [128, 256, 512])\n",
    "    learning_rate = trial.suggest_float(\"learning_rate\", 1e-6, 1e-4, log=True)\n",
    "    num_unfrozen = trial.suggest_int(\"num_unfrozen_layers\", 2, 10)\n",
    "\n",
    "    # Pré-processamento (sem augmentation para simplificar FT)\n",
    "    datagen = ImageDataGenerator(rescale=1./255)\n",
    "    train_generator = datagen.flow_from_directory('dataset_balanceado_final/train',\n",
    "        target_size=(150, 150), batch_size=32, class_mode='categorical')\n",
    "    val_generator = datagen.flow_from_directory('dataset_balanceado_final/validation',\n",
    "        target_size=(150, 150), batch_size=32, class_mode='categorical')\n",
    "\n",
    "    # VGG16 - Fine-Tuning\n",
    "    conv_base = VGG16(weights='imagenet', include_top=False, input_shape=(150, 150, 3))\n",
    "    conv_base.trainable = True\n",
    "\n",
    "    # Congelar camadas exceto as últimas `num_unfrozen`\n",
    "    for layer in conv_base.layers[:-num_unfrozen]:\n",
    "        layer.trainable = False\n",
    "\n",
    "    inputs = tf.keras.Input(shape=(150, 150, 3))\n",
    "    x = tf.keras.applications.vgg16.preprocess_input(inputs)\n",
    "    x = conv_base(x)\n",
    "    x = layers.Flatten()(x)\n",
    "    x = layers.Dense(dense_units, activation='relu')(x)\n",
    "    x = layers.Dropout(0.5)(x)\n",
    "    outputs = layers.Dense(7, activation='softmax')(x)\n",
    "\n",
    "    model = models.Model(inputs, outputs)\n",
    "\n",
    "    if optimizer_name == \"adam\":\n",
    "        optimizer = optimizers.Adam(learning_rate=learning_rate)\n",
    "    elif optimizer_name == \"rmsprop\":\n",
    "        optimizer = optimizers.RMSprop(learning_rate=learning_rate)\n",
    "    else:\n",
    "        optimizer = optimizers.SGD(learning_rate=learning_rate)\n",
    "\n",
    "    model.compile(optimizer=optimizer, loss=loss_fn, metrics=['accuracy'])\n",
    "\n",
    "    history = model.fit(train_generator, epochs=5, validation_data=val_generator, verbose=0)\n",
    "    return history.history[\"val_accuracy\"][-1]\n",
    "\n",
    "study_ft = optuna.create_study(direction=\"maximize\")\n",
    "study_ft.optimize(objective_ft, n_trials=20)\n",
    "print(\"Melhores parâmetros (Fine-Tuning):\", study_ft.best_params)\n"
   ]
  }
 ],
 "metadata": {
  "kernelspec": {
   "display_name": "venv",
   "language": "python",
   "name": "python3"
  },
  "language_info": {
   "codemirror_mode": {
    "name": "ipython",
    "version": 3
   },
   "file_extension": ".py",
   "mimetype": "text/x-python",
   "name": "python",
   "nbconvert_exporter": "python",
   "pygments_lexer": "ipython3",
   "version": "3.12.3"
  }
 },
 "nbformat": 4,
 "nbformat_minor": 5
}
