{
 "cells": [
  {
   "cell_type": "code",
   "execution_count": 1,
   "id": "a19478c6",
   "metadata": {},
   "outputs": [
    {
     "name": "stderr",
     "output_type": "stream",
     "text": [
      "/home/eliana/escola/venv/lib/python3.12/site-packages/tqdm/auto.py:21: TqdmWarning: IProgress not found. Please update jupyter and ipywidgets. See https://ipywidgets.readthedocs.io/en/stable/user_install.html\n",
      "  from .autonotebook import tqdm as notebook_tqdm\n",
      "2025-06-07 08:49:29.517819: E external/local_xla/xla/stream_executor/cuda/cuda_fft.cc:467] Unable to register cuFFT factory: Attempting to register factory for plugin cuFFT when one has already been registered\n",
      "WARNING: All log messages before absl::InitializeLog() is called are written to STDERR\n",
      "E0000 00:00:1749282569.531774  777971 cuda_dnn.cc:8579] Unable to register cuDNN factory: Attempting to register factory for plugin cuDNN when one has already been registered\n",
      "E0000 00:00:1749282569.536118  777971 cuda_blas.cc:1407] Unable to register cuBLAS factory: Attempting to register factory for plugin cuBLAS when one has already been registered\n",
      "W0000 00:00:1749282569.546803  777971 computation_placer.cc:177] computation placer already registered. Please check linkage and avoid linking the same target more than once.\n",
      "W0000 00:00:1749282569.546818  777971 computation_placer.cc:177] computation placer already registered. Please check linkage and avoid linking the same target more than once.\n",
      "W0000 00:00:1749282569.546819  777971 computation_placer.cc:177] computation placer already registered. Please check linkage and avoid linking the same target more than once.\n",
      "W0000 00:00:1749282569.546820  777971 computation_placer.cc:177] computation placer already registered. Please check linkage and avoid linking the same target more than once.\n",
      "2025-06-07 08:49:29.550357: I tensorflow/core/platform/cpu_feature_guard.cc:210] This TensorFlow binary is optimized to use available CPU instructions in performance-critical operations.\n",
      "To enable the following instructions: AVX2 FMA, in other operations, rebuild TensorFlow with the appropriate compiler flags.\n",
      "[I 2025-06-07 08:49:31,027] A new study created in memory with name: no-name-4eeaf873-77d0-4ae7-8087-d896dc74a7b1\n"
     ]
    },
    {
     "name": "stdout",
     "output_type": "stream",
     "text": [
      "Found 4276 images belonging to 7 classes.\n",
      "Found 1420 images belonging to 7 classes.\n"
     ]
    },
    {
     "name": "stderr",
     "output_type": "stream",
     "text": [
      "I0000 00:00:1749282571.347059  777971 gpu_device.cc:2019] Created device /job:localhost/replica:0/task:0/device:GPU:0 with 4804 MB memory:  -> device: 0, name: NVIDIA GeForce GTX 1660 SUPER, pci bus id: 0000:03:00.0, compute capability: 7.5\n",
      "I0000 00:00:1749282571.350575  777971 gpu_device.cc:2019] Created device /job:localhost/replica:0/task:0/device:GPU:1 with 4804 MB memory:  -> device: 1, name: NVIDIA GeForce GTX 1660 SUPER, pci bus id: 0000:05:00.0, compute capability: 7.5\n",
      "/home/eliana/escola/venv/lib/python3.12/site-packages/keras/src/trainers/data_adapters/py_dataset_adapter.py:121: UserWarning: Your `PyDataset` class should call `super().__init__(**kwargs)` in its constructor. `**kwargs` can include `workers`, `use_multiprocessing`, `max_queue_size`. Do not pass these arguments to `fit()`, as they will be ignored.\n",
      "  self._warn_if_super_not_called()\n",
      "WARNING: All log messages before absl::InitializeLog() is called are written to STDERR\n",
      "I0000 00:00:1749282574.306536  778044 service.cc:152] XLA service 0x7bd4800028c0 initialized for platform CUDA (this does not guarantee that XLA will be used). Devices:\n",
      "I0000 00:00:1749282574.306552  778044 service.cc:160]   StreamExecutor device (0): NVIDIA GeForce GTX 1660 SUPER, Compute Capability 7.5\n",
      "I0000 00:00:1749282574.306554  778044 service.cc:160]   StreamExecutor device (1): NVIDIA GeForce GTX 1660 SUPER, Compute Capability 7.5\n",
      "2025-06-07 08:49:34.350734: I tensorflow/compiler/mlir/tensorflow/utils/dump_mlir_util.cc:269] disabling MLIR crash reproducer, set env var `MLIR_CRASH_REPRODUCER_DIRECTORY` to enable.\n",
      "I0000 00:00:1749282574.731822  778044 cuda_dnn.cc:529] Loaded cuDNN version 90300\n",
      "2025-06-07 08:49:35.082740: I external/local_xla/xla/service/gpu/autotuning/conv_algorithm_picker.cc:549] Omitted potentially buggy algorithm eng14{k25=0} for conv %cudnn-conv-bias-activation.39 = (f32[32,64,150,150]{3,2,1,0}, u8[0]{0}) custom-call(f32[32,3,150,150]{3,2,1,0} %bitcast.5830, f32[64,3,3,3]{3,2,1,0} %bitcast.5837, f32[64]{0} %bitcast.5839), window={size=3x3 pad=1_1x1_1}, dim_labels=bf01_oi01->bf01, custom_call_target=\"__cudnn$convBiasActivationForward\", metadata={op_type=\"Conv2D\" op_name=\"functional_1/vgg16_1/block1_conv1_1/convolution\" source_file=\"/home/eliana/escola/venv/lib/python3.12/site-packages/tensorflow/python/framework/ops.py\" source_line=1200}, backend_config={\"operation_queue_id\":\"0\",\"wait_on_operation_queues\":[],\"cudnn_conv_backend_config\":{\"conv_result_scale\":1,\"activation_mode\":\"kRelu\",\"side_input_scale\":0,\"leakyrelu_alpha\":0},\"force_earliest_schedule\":false}\n",
      "2025-06-07 08:49:35.184638: I external/local_xla/xla/service/gpu/autotuning/conv_algorithm_picker.cc:549] Omitted potentially buggy algorithm eng14{k25=0} for conv %cudnn-conv-bias-activation.40 = (f32[32,64,150,150]{3,2,1,0}, u8[0]{0}) custom-call(f32[32,64,150,150]{3,2,1,0} %bitcast.5844, f32[64,64,3,3]{3,2,1,0} %bitcast.5851, f32[64]{0} %bitcast.5853), window={size=3x3 pad=1_1x1_1}, dim_labels=bf01_oi01->bf01, custom_call_target=\"__cudnn$convBiasActivationForward\", metadata={op_type=\"Conv2D\" op_name=\"functional_1/vgg16_1/block1_conv2_1/convolution\" source_file=\"/home/eliana/escola/venv/lib/python3.12/site-packages/tensorflow/python/framework/ops.py\" source_line=1200}, backend_config={\"operation_queue_id\":\"0\",\"wait_on_operation_queues\":[],\"cudnn_conv_backend_config\":{\"conv_result_scale\":1,\"activation_mode\":\"kRelu\",\"side_input_scale\":0,\"leakyrelu_alpha\":0},\"force_earliest_schedule\":false}\n",
      "2025-06-07 08:49:36.100533: I external/local_xla/xla/service/gpu/autotuning/conv_algorithm_picker.cc:549] Omitted potentially buggy algorithm eng14{k25=0} for conv %cudnn-conv-bias-activation.41 = (f32[32,128,75,75]{3,2,1,0}, u8[0]{0}) custom-call(f32[32,64,75,75]{3,2,1,0} %bitcast.5861, f32[128,64,3,3]{3,2,1,0} %bitcast.5868, f32[128]{0} %bitcast.5870), window={size=3x3 pad=1_1x1_1}, dim_labels=bf01_oi01->bf01, custom_call_target=\"__cudnn$convBiasActivationForward\", metadata={op_type=\"Conv2D\" op_name=\"functional_1/vgg16_1/block2_conv1_1/convolution\" source_file=\"/home/eliana/escola/venv/lib/python3.12/site-packages/tensorflow/python/framework/ops.py\" source_line=1200}, backend_config={\"operation_queue_id\":\"0\",\"wait_on_operation_queues\":[],\"cudnn_conv_backend_config\":{\"conv_result_scale\":1,\"activation_mode\":\"kRelu\",\"side_input_scale\":0,\"leakyrelu_alpha\":0},\"force_earliest_schedule\":false}\n",
      "2025-06-07 08:49:36.503050: I external/local_xla/xla/service/gpu/autotuning/conv_algorithm_picker.cc:549] Omitted potentially buggy algorithm eng14{k25=0} for conv %cudnn-conv-bias-activation.42 = (f32[32,128,75,75]{3,2,1,0}, u8[0]{0}) custom-call(f32[32,128,75,75]{3,2,1,0} %bitcast.5875, f32[128,128,3,3]{3,2,1,0} %bitcast.5882, f32[128]{0} %bitcast.5884), window={size=3x3 pad=1_1x1_1}, dim_labels=bf01_oi01->bf01, custom_call_target=\"__cudnn$convBiasActivationForward\", metadata={op_type=\"Conv2D\" op_name=\"functional_1/vgg16_1/block2_conv2_1/convolution\" source_file=\"/home/eliana/escola/venv/lib/python3.12/site-packages/tensorflow/python/framework/ops.py\" source_line=1200}, backend_config={\"operation_queue_id\":\"0\",\"wait_on_operation_queues\":[],\"cudnn_conv_backend_config\":{\"conv_result_scale\":1,\"activation_mode\":\"kRelu\",\"side_input_scale\":0,\"leakyrelu_alpha\":0},\"force_earliest_schedule\":false}\n",
      "2025-06-07 08:49:37.226170: I external/local_xla/xla/service/gpu/autotuning/conv_algorithm_picker.cc:549] Omitted potentially buggy algorithm eng14{k25=0} for conv %cudnn-conv-bias-activation.43 = (f32[32,256,37,37]{3,2,1,0}, u8[0]{0}) custom-call(f32[32,128,37,37]{3,2,1,0} %bitcast.5890, f32[256,128,3,3]{3,2,1,0} %bitcast.5897, f32[256]{0} %bitcast.5899), window={size=3x3 pad=1_1x1_1}, dim_labels=bf01_oi01->bf01, custom_call_target=\"__cudnn$convBiasActivationForward\", metadata={op_type=\"Conv2D\" op_name=\"functional_1/vgg16_1/block3_conv1_1/convolution\" source_file=\"/home/eliana/escola/venv/lib/python3.12/site-packages/tensorflow/python/framework/ops.py\" source_line=1200}, backend_config={\"operation_queue_id\":\"0\",\"wait_on_operation_queues\":[],\"cudnn_conv_backend_config\":{\"conv_result_scale\":1,\"activation_mode\":\"kRelu\",\"side_input_scale\":0,\"leakyrelu_alpha\":0},\"force_earliest_schedule\":false}\n",
      "2025-06-07 08:49:37.556300: I external/local_xla/xla/service/gpu/autotuning/conv_algorithm_picker.cc:549] Omitted potentially buggy algorithm eng14{k25=0} for conv %cudnn-conv-bias-activation.44 = (f32[32,256,37,37]{3,2,1,0}, u8[0]{0}) custom-call(f32[32,256,37,37]{3,2,1,0} %bitcast.5904, f32[256,256,3,3]{3,2,1,0} %bitcast.5911, f32[256]{0} %bitcast.5913), window={size=3x3 pad=1_1x1_1}, dim_labels=bf01_oi01->bf01, custom_call_target=\"__cudnn$convBiasActivationForward\", metadata={op_type=\"Conv2D\" op_name=\"functional_1/vgg16_1/block3_conv2_1/convolution\" source_file=\"/home/eliana/escola/venv/lib/python3.12/site-packages/tensorflow/python/framework/ops.py\" source_line=1200}, backend_config={\"operation_queue_id\":\"0\",\"wait_on_operation_queues\":[],\"cudnn_conv_backend_config\":{\"conv_result_scale\":1,\"activation_mode\":\"kRelu\",\"side_input_scale\":0,\"leakyrelu_alpha\":0},\"force_earliest_schedule\":false}\n",
      "2025-06-07 08:49:38.079802: I external/local_xla/xla/service/gpu/autotuning/conv_algorithm_picker.cc:549] Omitted potentially buggy algorithm eng14{k25=0} for conv %cudnn-conv-bias-activation.46 = (f32[32,512,18,18]{3,2,1,0}, u8[0]{0}) custom-call(f32[32,256,18,18]{3,2,1,0} %bitcast.6184, f32[512,256,3,3]{3,2,1,0} %bitcast.5940, f32[512]{0} %bitcast.6574), window={size=3x3 pad=1_1x1_1}, dim_labels=bf01_oi01->bf01, custom_call_target=\"__cudnn$convBiasActivationForward\", metadata={op_type=\"Conv2D\" op_name=\"functional_1/vgg16_1/block4_conv1_1/convolution\" source_file=\"/home/eliana/escola/venv/lib/python3.12/site-packages/tensorflow/python/framework/ops.py\" source_line=1200}, backend_config={\"operation_queue_id\":\"0\",\"wait_on_operation_queues\":[],\"cudnn_conv_backend_config\":{\"conv_result_scale\":1,\"activation_mode\":\"kNone\",\"side_input_scale\":0,\"leakyrelu_alpha\":0},\"force_earliest_schedule\":false}\n",
      "2025-06-07 08:49:38.384871: I external/local_xla/xla/service/gpu/autotuning/conv_algorithm_picker.cc:549] Omitted potentially buggy algorithm eng14{k25=0} for conv %cudnn-conv-bias-activation.47 = (f32[32,512,18,18]{3,2,1,0}, u8[0]{0}) custom-call(f32[32,512,18,18]{3,2,1,0} %bitcast.6638, f32[512,512,3,3]{3,2,1,0} %bitcast.5958, f32[512]{0} %bitcast.6698), window={size=3x3 pad=1_1x1_1}, dim_labels=bf01_oi01->bf01, custom_call_target=\"__cudnn$convBiasActivationForward\", metadata={op_type=\"Conv2D\" op_name=\"functional_1/vgg16_1/block4_conv2_1/convolution\" source_file=\"/home/eliana/escola/venv/lib/python3.12/site-packages/tensorflow/python/framework/ops.py\" source_line=1200}, backend_config={\"operation_queue_id\":\"0\",\"wait_on_operation_queues\":[],\"cudnn_conv_backend_config\":{\"conv_result_scale\":1,\"activation_mode\":\"kNone\",\"side_input_scale\":0,\"leakyrelu_alpha\":0},\"force_earliest_schedule\":false}\n",
      "2025-06-07 08:49:38.810588: I external/local_xla/xla/service/gpu/autotuning/conv_algorithm_picker.cc:549] Omitted potentially buggy algorithm eng14{k25=0} for conv %cudnn-conv-bias-activation.49 = (f32[32,512,9,9]{3,2,1,0}, u8[0]{0}) custom-call(f32[32,512,9,9]{3,2,1,0} %bitcast.6884, f32[512,512,3,3]{3,2,1,0} %bitcast.5995, f32[512]{0} %bitcast.6944), window={size=3x3 pad=1_1x1_1}, dim_labels=bf01_oi01->bf01, custom_call_target=\"__cudnn$convBiasActivationForward\", metadata={op_type=\"Conv2D\" op_name=\"functional_1/vgg16_1/block5_conv1_1/convolution\" source_file=\"/home/eliana/escola/venv/lib/python3.12/site-packages/tensorflow/python/framework/ops.py\" source_line=1200}, backend_config={\"operation_queue_id\":\"0\",\"wait_on_operation_queues\":[],\"cudnn_conv_backend_config\":{\"conv_result_scale\":1,\"activation_mode\":\"kNone\",\"side_input_scale\":0,\"leakyrelu_alpha\":0},\"force_earliest_schedule\":false}\n",
      "I0000 00:00:1749282582.592299  778044 device_compiler.h:188] Compiled cluster using XLA!  This line is logged at most once for the lifetime of the process.\n",
      "2025-06-07 08:49:53.590994: I external/local_xla/xla/service/gpu/autotuning/conv_algorithm_picker.cc:549] Omitted potentially buggy algorithm eng14{k25=0} for conv %cudnn-conv-bias-activation.39 = (f32[20,64,150,150]{3,2,1,0}, u8[0]{0}) custom-call(f32[20,3,150,150]{3,2,1,0} %bitcast.5830, f32[64,3,3,3]{3,2,1,0} %bitcast.5837, f32[64]{0} %bitcast.5839), window={size=3x3 pad=1_1x1_1}, dim_labels=bf01_oi01->bf01, custom_call_target=\"__cudnn$convBiasActivationForward\", metadata={op_type=\"Conv2D\" op_name=\"functional_1/vgg16_1/block1_conv1_1/convolution\" source_file=\"/home/eliana/escola/venv/lib/python3.12/site-packages/tensorflow/python/framework/ops.py\" source_line=1200}, backend_config={\"operation_queue_id\":\"0\",\"wait_on_operation_queues\":[],\"cudnn_conv_backend_config\":{\"conv_result_scale\":1,\"activation_mode\":\"kRelu\",\"side_input_scale\":0,\"leakyrelu_alpha\":0},\"force_earliest_schedule\":false}\n",
      "2025-06-07 08:49:53.691385: I external/local_xla/xla/service/gpu/autotuning/conv_algorithm_picker.cc:549] Omitted potentially buggy algorithm eng14{k25=0} for conv %cudnn-conv-bias-activation.40 = (f32[20,64,150,150]{3,2,1,0}, u8[0]{0}) custom-call(f32[20,64,150,150]{3,2,1,0} %bitcast.5844, f32[64,64,3,3]{3,2,1,0} %bitcast.5851, f32[64]{0} %bitcast.5853), window={size=3x3 pad=1_1x1_1}, dim_labels=bf01_oi01->bf01, custom_call_target=\"__cudnn$convBiasActivationForward\", metadata={op_type=\"Conv2D\" op_name=\"functional_1/vgg16_1/block1_conv2_1/convolution\" source_file=\"/home/eliana/escola/venv/lib/python3.12/site-packages/tensorflow/python/framework/ops.py\" source_line=1200}, backend_config={\"operation_queue_id\":\"0\",\"wait_on_operation_queues\":[],\"cudnn_conv_backend_config\":{\"conv_result_scale\":1,\"activation_mode\":\"kRelu\",\"side_input_scale\":0,\"leakyrelu_alpha\":0},\"force_earliest_schedule\":false}\n",
      "2025-06-07 08:49:54.301251: I external/local_xla/xla/service/gpu/autotuning/conv_algorithm_picker.cc:549] Omitted potentially buggy algorithm eng14{k25=0} for conv %cudnn-conv-bias-activation.41 = (f32[20,128,75,75]{3,2,1,0}, u8[0]{0}) custom-call(f32[20,64,75,75]{3,2,1,0} %bitcast.5861, f32[128,64,3,3]{3,2,1,0} %bitcast.5868, f32[128]{0} %bitcast.5870), window={size=3x3 pad=1_1x1_1}, dim_labels=bf01_oi01->bf01, custom_call_target=\"__cudnn$convBiasActivationForward\", metadata={op_type=\"Conv2D\" op_name=\"functional_1/vgg16_1/block2_conv1_1/convolution\" source_file=\"/home/eliana/escola/venv/lib/python3.12/site-packages/tensorflow/python/framework/ops.py\" source_line=1200}, backend_config={\"operation_queue_id\":\"0\",\"wait_on_operation_queues\":[],\"cudnn_conv_backend_config\":{\"conv_result_scale\":1,\"activation_mode\":\"kRelu\",\"side_input_scale\":0,\"leakyrelu_alpha\":0},\"force_earliest_schedule\":false}\n",
      "2025-06-07 08:49:54.593912: I external/local_xla/xla/service/gpu/autotuning/conv_algorithm_picker.cc:549] Omitted potentially buggy algorithm eng14{k25=0} for conv %cudnn-conv-bias-activation.42 = (f32[20,128,75,75]{3,2,1,0}, u8[0]{0}) custom-call(f32[20,128,75,75]{3,2,1,0} %bitcast.5875, f32[128,128,3,3]{3,2,1,0} %bitcast.5882, f32[128]{0} %bitcast.5884), window={size=3x3 pad=1_1x1_1}, dim_labels=bf01_oi01->bf01, custom_call_target=\"__cudnn$convBiasActivationForward\", metadata={op_type=\"Conv2D\" op_name=\"functional_1/vgg16_1/block2_conv2_1/convolution\" source_file=\"/home/eliana/escola/venv/lib/python3.12/site-packages/tensorflow/python/framework/ops.py\" source_line=1200}, backend_config={\"operation_queue_id\":\"0\",\"wait_on_operation_queues\":[],\"cudnn_conv_backend_config\":{\"conv_result_scale\":1,\"activation_mode\":\"kRelu\",\"side_input_scale\":0,\"leakyrelu_alpha\":0},\"force_earliest_schedule\":false}\n",
      "2025-06-07 08:49:55.091434: I external/local_xla/xla/service/gpu/autotuning/conv_algorithm_picker.cc:549] Omitted potentially buggy algorithm eng14{k25=0} for conv %cudnn-conv-bias-activation.43 = (f32[20,256,37,37]{3,2,1,0}, u8[0]{0}) custom-call(f32[20,128,37,37]{3,2,1,0} %bitcast.5890, f32[256,128,3,3]{3,2,1,0} %bitcast.5897, f32[256]{0} %bitcast.5899), window={size=3x3 pad=1_1x1_1}, dim_labels=bf01_oi01->bf01, custom_call_target=\"__cudnn$convBiasActivationForward\", metadata={op_type=\"Conv2D\" op_name=\"functional_1/vgg16_1/block3_conv1_1/convolution\" source_file=\"/home/eliana/escola/venv/lib/python3.12/site-packages/tensorflow/python/framework/ops.py\" source_line=1200}, backend_config={\"operation_queue_id\":\"0\",\"wait_on_operation_queues\":[],\"cudnn_conv_backend_config\":{\"conv_result_scale\":1,\"activation_mode\":\"kRelu\",\"side_input_scale\":0,\"leakyrelu_alpha\":0},\"force_earliest_schedule\":false}\n",
      "2025-06-07 08:49:55.315375: I external/local_xla/xla/service/gpu/autotuning/conv_algorithm_picker.cc:549] Omitted potentially buggy algorithm eng14{k25=0} for conv %cudnn-conv-bias-activation.44 = (f32[20,256,37,37]{3,2,1,0}, u8[0]{0}) custom-call(f32[20,256,37,37]{3,2,1,0} %bitcast.5904, f32[256,256,3,3]{3,2,1,0} %bitcast.5911, f32[256]{0} %bitcast.5913), window={size=3x3 pad=1_1x1_1}, dim_labels=bf01_oi01->bf01, custom_call_target=\"__cudnn$convBiasActivationForward\", metadata={op_type=\"Conv2D\" op_name=\"functional_1/vgg16_1/block3_conv2_1/convolution\" source_file=\"/home/eliana/escola/venv/lib/python3.12/site-packages/tensorflow/python/framework/ops.py\" source_line=1200}, backend_config={\"operation_queue_id\":\"0\",\"wait_on_operation_queues\":[],\"cudnn_conv_backend_config\":{\"conv_result_scale\":1,\"activation_mode\":\"kRelu\",\"side_input_scale\":0,\"leakyrelu_alpha\":0},\"force_earliest_schedule\":false}\n",
      "2025-06-07 08:49:55.689551: I external/local_xla/xla/service/gpu/autotuning/conv_algorithm_picker.cc:549] Omitted potentially buggy algorithm eng14{k25=0} for conv %cudnn-conv-bias-activation.46 = (f32[20,512,18,18]{3,2,1,0}, u8[0]{0}) custom-call(f32[20,256,18,18]{3,2,1,0} %bitcast.6184, f32[512,256,3,3]{3,2,1,0} %bitcast.5940, f32[512]{0} %bitcast.6574), window={size=3x3 pad=1_1x1_1}, dim_labels=bf01_oi01->bf01, custom_call_target=\"__cudnn$convBiasActivationForward\", metadata={op_type=\"Conv2D\" op_name=\"functional_1/vgg16_1/block4_conv1_1/convolution\" source_file=\"/home/eliana/escola/venv/lib/python3.12/site-packages/tensorflow/python/framework/ops.py\" source_line=1200}, backend_config={\"operation_queue_id\":\"0\",\"wait_on_operation_queues\":[],\"cudnn_conv_backend_config\":{\"conv_result_scale\":1,\"activation_mode\":\"kNone\",\"side_input_scale\":0,\"leakyrelu_alpha\":0},\"force_earliest_schedule\":false}\n",
      "2025-06-07 08:49:55.911262: I external/local_xla/xla/service/gpu/autotuning/conv_algorithm_picker.cc:549] Omitted potentially buggy algorithm eng14{k25=0} for conv %cudnn-conv-bias-activation.47 = (f32[20,512,18,18]{3,2,1,0}, u8[0]{0}) custom-call(f32[20,512,18,18]{3,2,1,0} %bitcast.6638, f32[512,512,3,3]{3,2,1,0} %bitcast.5958, f32[512]{0} %bitcast.6698), window={size=3x3 pad=1_1x1_1}, dim_labels=bf01_oi01->bf01, custom_call_target=\"__cudnn$convBiasActivationForward\", metadata={op_type=\"Conv2D\" op_name=\"functional_1/vgg16_1/block4_conv2_1/convolution\" source_file=\"/home/eliana/escola/venv/lib/python3.12/site-packages/tensorflow/python/framework/ops.py\" source_line=1200}, backend_config={\"operation_queue_id\":\"0\",\"wait_on_operation_queues\":[],\"cudnn_conv_backend_config\":{\"conv_result_scale\":1,\"activation_mode\":\"kNone\",\"side_input_scale\":0,\"leakyrelu_alpha\":0},\"force_earliest_schedule\":false}\n",
      "2025-06-07 08:49:56.315308: I external/local_xla/xla/service/gpu/autotuning/conv_algorithm_picker.cc:549] Omitted potentially buggy algorithm eng14{k25=0} for conv %cudnn-conv-bias-activation.49 = (f32[20,512,9,9]{3,2,1,0}, u8[0]{0}) custom-call(f32[20,512,9,9]{3,2,1,0} %bitcast.6884, f32[512,512,3,3]{3,2,1,0} %bitcast.5995, f32[512]{0} %bitcast.6944), window={size=3x3 pad=1_1x1_1}, dim_labels=bf01_oi01->bf01, custom_call_target=\"__cudnn$convBiasActivationForward\", metadata={op_type=\"Conv2D\" op_name=\"functional_1/vgg16_1/block5_conv1_1/convolution\" source_file=\"/home/eliana/escola/venv/lib/python3.12/site-packages/tensorflow/python/framework/ops.py\" source_line=1200}, backend_config={\"operation_queue_id\":\"0\",\"wait_on_operation_queues\":[],\"cudnn_conv_backend_config\":{\"conv_result_scale\":1,\"activation_mode\":\"kNone\",\"side_input_scale\":0,\"leakyrelu_alpha\":0},\"force_earliest_schedule\":false}\n",
      "2025-06-07 08:50:13.306291: I external/local_xla/xla/service/gpu/autotuning/conv_algorithm_picker.cc:549] Omitted potentially buggy algorithm eng14{k25=0} for conv %cudnn-conv-bias-activation.46 = (f32[32,512,18,18]{3,2,1,0}, u8[0]{0}) custom-call(f32[32,256,18,18]{3,2,1,0} %bitcast.957, f32[512,256,3,3]{3,2,1,0} %bitcast.964, f32[512]{0} %bitcast.966), window={size=3x3 pad=1_1x1_1}, dim_labels=bf01_oi01->bf01, custom_call_target=\"__cudn