      "[I 2025-06-06 19:47:12,583] Trial 0 finished with value: 0.15422534942626953 and parameters: {'use_data_aug': True, 'optimizer': 'sgd', 'loss_function': 'mse', 'dense_units': 256, 'learning_rate': 1.497352449302603e-05}. Best is trial 0 with value: 0.15422534942626953.\n"
     ]
    },
    {
     "name": "stdout",
     "output_type": "stream",
     "text": [
      "Found 4276 images belonging to 7 classes.\n",
      "Found 1420 images belonging to 7 classes.\n"
     ]
    },
    {
     "name": "stderr",
     "output_type": "stream",
     "text": [
      "[I 2025-06-06 19:48:53,168] Trial 1 finished with value: 0.15633802115917206 and parameters: {'use_data_aug': False, 'optimizer': 'rmsprop', 'loss_function': 'categorical_crossentropy', 'dense_units': 512, 'learning_rate': 0.0009347551677135758}. Best is trial 1 with value: 0.15633802115917206.\n"
     ]
    },
    {
     "name": "stdout",
     "output_type": "stream",
     "text": [
      "Found 4276 images belonging to 7 classes.\n",
      "Found 1420 images belonging to 7 classes.\n"
     ]
    },
    {
     "name": "stderr",
     "output_type": "stream",
     "text": [
      "[I 2025-06-06 19:51:16,949] Trial 2 finished with value: 0.15633802115917206 and parameters: {'use_data_aug': True, 'optimizer': 'rmsprop', 'loss_function': 'kld', 'dense_units': 128, 'learning_rate': 0.0008340811996121601}. Best is trial 1 with value: 0.15633802115917206.\n"
     ]
    },
    {
     "name": "stdout",
     "output_type": "stream",
     "text": [
      "Found 4276 images belonging to 7 classes.\n",
      "Found 1420 images belonging to 7 classes.\n"
     ]
    },
    {
     "name": "stderr",
     "output_type": "stream",
     "text": [
      "[I 2025-06-06 19:53:40,474] Trial 3 finished with value: 0.15422534942626953 and parameters: {'use_data_aug': True, 'optimizer': 'sgd', 'loss_function': 'kld', 'dense_units': 256, 'learning_rate': 3.250696823044371e-05}. Best is trial 1 with value: 0.15633802115917206.\n"
     ]
    },
    {
     "name": "stdout",
     "output_type": "stream",
     "text": [
      "Found 4276 images belonging to 7 classes.\n",
      "Found 1420 images belonging to 7 classes.\n"
     ]
    },
    {
     "name": "stderr",
     "output_type": "stream",
     "text": [
      "[I 2025-06-06 19:55:21,748] Trial 4 finished with value: 0.15633802115917206 and parameters: {'use_data_aug': False, 'optimizer': 'rmsprop', 'loss_function': 'categorical_crossentropy', 'dense_units': 512, 'learning_rate': 1.864655187798727e-05}. Best is trial 1 with value: 0.15633802115917206.\n"
     ]
    },
    {
     "name": "stdout",
     "output_type": "stream",
     "text": [
      "Found 4276 images belonging to 7 classes.\n",
      "Found 1420 images belonging to 7 classes.\n"
     ]
    },
    {
     "name": "stderr",
     "output_type": "stream",
     "text": [
      "[I 2025-06-06 19:57:03,239] Trial 5 finished with value: 0.145070418715477 and parameters: {'use_data_aug': False, 'optimizer': 'sgd', 'loss_function': 'categorical_crossentropy', 'dense_units': 512, 'learning_rate': 2.612795843881944e-05}. Best is trial 1 with value: 0.15633802115917206.\n"
     ]
    },
    {
     "name": "stdout",
     "output_type": "stream",
     "text": [
      "Found 4276 images belonging to 7 classes.\n",
      "Found 1420 images belonging to 7 classes.\n"
     ]
    },
    {
     "name": "stderr",
     "output_type": "stream",
     "text": [
      "[I 2025-06-06 19:59:27,341] Trial 6 finished with value: 0.1401408463716507 and parameters: {'use_data_aug': True, 'optimizer': 'adam', 'loss_function': 'kld', 'dense_units': 256, 'learning_rate': 7.611156807415723e-05}. Best is trial 1 with value: 0.15633802115917206.\n"
     ]
    },
    {
     "name": "stdout",
     "output_type": "stream",
     "text": [
      "Found 4276 images belonging to 7 classes.\n",
      "Found 1420 images belonging to 7 classes.\n"
     ]
    },
    {
     "name": "stderr",
     "output_type": "stream",
     "text": [
      "[I 2025-06-06 20:01:07,672] Trial 7 finished with value: 0.15633802115917206 and parameters: {'use_data_aug': False, 'optimizer': 'sgd', 'loss_function': 'mse', 'dense_units': 128, 'learning_rate': 0.00014756832757374454}. Best is trial 1 with value: 0.15633802115917206.\n"
     ]
    },
    {
     "name": "stdout",
     "output_type": "stream",
     "text": [
      "Found 4276 images belonging to 7 classes.\n",
      "Found 1420 images belonging to 7 classes.\n"
     ]
    },
    {
     "name": "stderr",
     "output_type": "stream",
     "text": [
      "[I 2025-06-06 20:03:30,758] Trial 8 finished with value: 0.15633802115917206 and parameters: {'use_data_aug': True, 'optimizer': 'rmsprop', 'loss_function': 'mse', 'dense_units': 256, 'learning_rate': 1.0104410184559599e-05}. Best is trial 1 with value: 0.15633802115917206.\n"
     ]
    },
    {
     "name": "stdout",
     "output_type": "stream",
     "text": [
      "Found 4276 images belonging to 7 classes.\n",
      "Found 1420 images belonging to 7 classes.\n"
     ]
    },
    {
     "name": "stderr",
     "output_type": "stream",
     "text": [
      "[I 2025-06-06 20:05:12,203] Trial 9 finished with value: 0.15633802115917206 and parameters: {'use_data_aug': False, 'optimizer': 'adam', 'loss_function': 'kld', 'dense_units': 256, 'learning_rate': 2.8662008398973856e-05}. Best is trial 1 with value: 0.15633802115917206.\n"
     ]
    },
    {
     "name": "stdout",
     "output_type": "stream",
     "text": [
      "Found 4276 images belonging to 7 classes.\n",
      "Found 1420 images belonging to 7 classes.\n"
     ]
    },
    {
     "name": "stderr",
     "output_type": "stream",
     "text": [
      "[I 2025-06-06 20:06:53,873] Trial 10 finished with value: 0.15422534942626953 and parameters: {'use_data_aug': False, 'optimizer': 'rmsprop', 'loss_function': 'categorical_crossentropy', 'dense_units': 512, 'learning_rate': 0.0009920934351454714}. Best is trial 1 with value: 0.15633802115917206.\n"
     ]
    },
    {
     "name": "stdout",
     "output_type": "stream",
     "text": [
      "Found 4276 images belonging to 7 classes.\n",
      "Found 1420 images belonging to 7 classes.\n"
     ]
    },
    {
     "name": "stderr",
     "output_type": "stream",
     "text": [
      "[I 2025-06-06 20:09:17,200] Trial 11 finished with value: 0.15633802115917206 and parameters: {'use_data_aug': True, 'optimizer': 'rmsprop', 'loss_function': 'categorical_crossentropy', 'dense_units': 128, 'learning_rate': 0.0008694997392910193}. Best is trial 1 with value: 0.15633802115917206.\n"
     ]
    },
    {
     "name": "stdout",
     "output_type": "stream",
     "text": [
      "Found 4276 images belonging to 7 classes.\n",
      "Found 1420 images belonging to 7 classes.\n"
     ]
    },
    {
     "name": "stderr",
     "output_type": "stream",
     "text": [
      "[I 2025-06-06 20:10:58,335] Trial 12 finished with value: 0.15633802115917206 and parameters: {'use_data_aug': False, 'optimizer': 'rmsprop', 'loss_function': 'kld', 'dense_units': 128, 'learning_rate': 0.0003915552582510061}. Best is trial 1 with value: 0.15633802115917206.\n"
     ]
    },
    {
     "name": "stdout",
     "output_type": "stream",
     "text": [
      "Found 4276 images belonging to 7 classes.\n",
      "Found 1420 images belonging to 7 classes.\n"
     ]
    },
    {
     "name": "stderr",
     "output_type": "stream",
     "text": [
      "[I 2025-06-06 20:13:21,898] Trial 13 finished with value: 0.15633802115917206 and parameters: {'use_data_aug': True, 'optimizer': 'rmsprop', 'loss_function': 'kld', 'dense_units': 128, 'learning_rate': 0.00036063060381316746}. Best is trial 1 with value: 0.15633802115917206.\n"
     ]
    },
    {
     "name": "stdout",
     "output_type": "stream",
     "text": [
      "Found 4276 images belonging to 7 classes.\n",
      "Found 1420 images belonging to 7 classes.\n"
     ]
    },
    {
     "name": "stderr",
     "output_type": "stream",
     "text": [
      "[I 2025-06-06 20:15:45,111] Trial 14 finished with value: 0.15633802115917206 and parameters: {'use_data_aug': True, 'optimizer': 'rmsprop', 'loss_function': 'categorical_crossentropy', 'dense_units': 512, 'learning_rate': 0.0004116396423923621}. Best is trial 1 with value: 0.15633802115917206.\n"
     ]
    },
    {
     "name": "stdout",
     "output_type": "stream",
     "text": [
      "Found 4276 images belonging to 7 classes.\n",
      "Found 1420 images belonging to 7 classes.\n"
     ]
    },
    {
     "name": "stderr",
     "output_type": "stream",
     "text": [
      "[I 2025-06-06 20:17:25,916] Trial 15 finished with value: 0.15633802115917206 and parameters: {'use_data_aug': False, 'optimizer': 'rmsprop', 'loss_function': 'categorical_crossentropy', 'dense_units': 128, 'learning_rate': 0.00019812266851918027}. Best is trial 1 with value: 0.15633802115917206.\n"
     ]
    },
    {
     "name": "stdout",
     "output_type": "stream",
     "text": [
      "Found 4276 images belonging to 7 classes.\n",
      "Found 1420 images belonging to 7 classes.\n"
     ]
    },
    {
     "name": "stderr",
     "output_type": "stream",
     "text": [
      "[I 2025-06-06 20:19:49,572] Trial 16 finished with value: 0.15633802115917206 and parameters: {'use_data_aug': True, 'optimizer': 'adam', 'loss_function': 'kld', 'dense_units': 512, 'learning_rate': 0.0006836672737128289}. Best is trial 1 with value: 0.15633802115917206.\n"
     ]
    },
    {
     "name": "stdout",
     "output_type": "stream",
     "text": [
      "Found 4276 images belonging to 7 classes.\n",
      "Found 1420 images belonging to 7 classes.\n"
     ]
    },
    {
     "name": "stderr",
     "output_type": "stream",
     "text": [
      "[I 2025-06-06 20:21:30,828] Trial 17 finished with value: 0.15633802115917206 and parameters: {'use_data_aug': False, 'optimizer': 'rmsprop', 'loss_function': 'kld', 'dense_units': 128, 'learning_rate': 5.979208638024344e-05}. Best is trial 1 with value: 0.15633802115917206.\n"
     ]
    },
    {
     "name": "stdout",
     "output_type": "stream",
     "text": [
      "Found 4276 images belonging to 7 classes.\n",
      "Found 1420 images belonging to 7 classes.\n"
     ]
    },
    {
     "name": "stderr",
     "output_type": "stream",
     "text": [
      "[I 2025-06-06 20:23:53,867] Trial 18 finished with value: 0.13943661749362946 and parameters: {'use_data_aug': True, 'optimizer': 'rmsprop', 'loss_function': 'categorical_crossentropy', 'dense_units': 512, 'learning_rate': 0.00022207913484852614}. Best is trial 1 with value: 0.15633802115917206.\n"
     ]
    },
    {
     "name": "stdout",
     "output_type": "stream",
     "text": [
      "Found 4276 images belonging to 7 classes.\n",
      "Found 1420 images belonging to 7 classes.\n"
     ]
    },
    {
     "name": "stderr",
     "output_type": "stream",
     "text": [
      "[I 2025-06-06 20:25:34,808] Trial 19 finished with value: 0.15633802115917206 and parameters: {'use_data_aug': False, 'optimizer': 'adam', 'loss_function': 'mse', 'dense_units': 128, 'learning_rate': 0.0005833713441867398}. Best is trial 1 with value: 0.15633802115917206.\n"
     ]
    },
    {
     "name": "stdout",
     "output_type": "stream",
     "text": [
      "Melhores parâmetros (Feature Extraction): {'use_data_aug': False, 'optimizer': 'rmsprop', 'loss_function': 'categorical_crossentropy', 'dense_units': 512, 'learning_rate': 0.0009347551677135758}\n"
     ]
    }
   ],
   "source": [
    "import optuna\n",
    "import tensorflow as tf\n",
    "from tensorflow.keras import layers, models, optimizers\n",
    "from tensorflow.keras.applications import VGG16\n",
    "from tensorflow.keras.preprocessing.image import ImageDataGenerator\n",
    "\n",
    "\n",
    "def objective_fe(trial):\n",
    "    # Hiperparâmetros\n",
    "    use_data_aug = trial.suggest_categorical(\"use_data_aug\", [True, False])\n",
    "    optimizer_name = trial.suggest_categorical(\"optimizer\", [\"adam\", \"rmsprop\", \"sgd\"])\n",
    "    loss_fn = trial.suggest_categorical(\"loss_function\", [\"categorical_crossentropy\", \"kld\", \"mse\"])\n",
    "    dense_units = trial.suggest_categorical(\"dense_units\", [128, 256, 512])\n",
    "    learning_rate = trial.suggest_float(\"learning_rate\", 1e-5, 1e-3, log=True)\n",
    "\n",
    "    # Augmentation\n",
    "    if use_data_aug:\n",
    "        train_datagen = ImageDataGenerator(rescale=1./255, rotation_range=20, zoom_range=0.2, horizontal_flip=True)\n",
    "    else:\n",
    "        train_datagen = ImageDataGenerator(rescale=1./255)\n",
    "\n",
    "    val_datagen = ImageDataGenerator(rescale=1./255)\n",
    "\n",
    "    train_generator = train_datagen.flow_from_directory('dataset_balanceado_final/train',\n",
    "        target_size=(150, 150), batch_size=32, class_mode='categorical')\n",
    "    val_generator = val_datagen.flow_from_directory('dataset_balanceado_final/validation',\n",
    "        target_size=(150, 150), batch_size=32, class_mode='categorical')\n",
    "\n",
    "    # VGG16 congelado (Feature Extraction)\n",
    "    conv_base = VGG16(weights='imagenet', include_top=False, input_shape=(150, 150, 3))\n",
    "    conv_base.trainable = False\n",
    "\n",
    "    inputs = tf.keras.Input(shape=(150, 150, 3))\n",
    "    x = tf.keras.applications.vgg16.preprocess_input(inputs)\n",
    "    x = conv_base(x)\n",
    "    x = layers.Flatten()(x)\n",
    "    x = layers.Dense(dense_units, activation='relu')(x)\n",
    "    x = layers.Dropout(0.5)(x)\n",
    "    outputs = layers.Dense(7, activation='softmax')(x)\n",
    "\n",
    "    model = models.Model(inputs, outputs)\n",
    "\n",
    "    # Otimizador\n",
    "    if optimizer_name == \"adam\":\n",
    "        optimizer = optimizers.Adam(learning_rate=learning_rate)\n",
    "    elif optimizer_name == \"rmsprop\":\n",
    "        optimizer = optimizers.RMSprop(learning_rate=learning_rate)\n",
    "    else:\n",
    "        optimizer = optimizers.SGD(learning_rate=learning_rate)\n",
    "\n",
    "    model.compile(optimizer=optimizer, loss=loss_fn, metrics=['accuracy'])\n",
    "\n",
    "    history = model.fit(train_generator, epochs=5, validation_data=val_generator, verbose=0)\n",
    "    return history.history[\"val_accuracy\"][-1]\n",
    "\n",
    "study_fe = optuna.create_study(direction=\"maximize\")\n",
    "study_fe.optimize(objective_fe, n_trials=20)\n",
    "print(\"Melhores parâmetros (Feature Extraction):\", study_fe.best_params)\n"
   ]
  }
 ],
 "metadata": {
  "kernelspec": {
   "display_name": "venv",
   "language": "python",
   "name": "python3"
  },
  "language_info": {
   "codemirror_mode": {
    "name": "ipython",
    "version": 3
   },
   "file_extension": ".py",
   "mimetype": "text/x-python",
   "name": "python",
   "nbconvert_exporter": "python",
   "pygments_lexer": "ipython3",
   "version": "3.12.3"
  }
 },
 "nbformat": 4,
 "nbformat_minor": 5
}
